{
  "correlation": {
    "matched": [],
    "missing": [],
    "orphans": [],
    "summary": {
      "orphan_commits": 0,
      "stories_with_commits": 0,
      "stories_without_commits": 0,
      "total_commits": 0,
      "total_issues": 1,
      "total_stories": 1
    }
  },
  "generated_at": "2025-10-27T11:50:08-07:00",
  "git_sha": "deca66688d3d6aff43d8ba1db106aee480ad1e88",
  "issues": [
    {
      "event_type": "jira:issue_updated",
      "issue_key": "A",
      "phoenix_updated_at": "2024-04-30T17:00:00-07:00",
      "updated_at": "2024-05-01T00:00:00Z"
    }
  ],
  "run_id": "0119f7f3-9704-4d93-988e-e4f7ed3be4d0",
  "timezone": "America/Phoenix"
}
